[
  {
    "id": "t1",
    "title": "Vereinsheim SGT Istanbul",
    "tags": [
      "sports",
      "building"
    ],
    "image": null,
    "summary": "Bau eines Vereinsheims für den SGT Istanbul auf dem SGM-Gelände. Nach mehreren Standortvarianten und Abstimmungsgesprächen zwischen SGT, SGM und Jugendhaus wurde ein Kompromiss gefunden.",
    "history": [
      {
        "date": "2024-01-01",
        "type": "proposal",
        "title": "SGT beantragt Vereinsheim",
        "text": "Der SGT Istanbul plant seit längerem ein eigenes Vereinsheim für seine rund 250 Mitglieder auf dem SGM-Gelände. Verschiedene Standortvarianten werden geprüft."
      },
      {
        "date": "2025-12-01",
        "type": "committee",
        "title": "Machbarkeitsstudie beauftragt",
        "text": "Landschaftsplaner Berger untersucht verschiedene Standortvarianten. Variante 2 wird von der Verwaltung und der SGM favorisiert."
      },
      {
        "date": "2026-01-12",
        "type": "vote",
        "title": "Zurückstellung im Stadtrat",
        "text": "Der Stadtrat vertagt die Entscheidung. Eine nochmalige Besprechung mit SGT, SGM und Jugendhaus soll eine einvernehmliche Lösung herbeiführen.",
        "sessionId": "sr_20260112",
        "voteId": "sr_20260112_02",
        "press": [
          "merkur_2026-01-12_sgt-vereinsheim"
        ]
      },
      {
        "date": "2026-02-02",
        "type": "vote",
        "title": "Variante 4 beschlossen",
        "text": "Nach Einigung aller Beteiligten beschließt der Stadtrat einstimmig, Variante 4 weiterzuverfolgen.",
        "sessionId": "sr_20260202",
        "voteId": "sr_20260202_01",
        "press": [
          "merkur_2026-02-02_sgt-vereinsheim"
        ]
      }
    ],
    "field": "sports",
    "type": "vorhaben",
    "status": "laufend"
  },
  {
    "id": "t2",
    "title": "Sanierung Bahnhof Moosburg",
    "tags": [
      "building",
      "infrastructure"
    ],
    "image": null,
    "summary": "Seit dem Erwerb des Bahnhofsgebäudes 2019 wird über die Zukunft des Moosburger Bahnhofs diskutiert. Varianten reichen von Pinselsanierung über Investorenmodelle bis zu Abriss und Container.",
    "history": [
      {
        "date": "2019-01-01",
        "type": "milestone",
        "title": "Erwerb des Bahnhofs",
        "text": "Die Stadt Moosburg erwirbt das Bahnhofsgebäude von der Deutschen Bahn."
      },
      {
        "date": "2022-02-07",
        "type": "vote",
        "title": "Ärztehaus im Bahnhof abgelehnt",
        "text": "Welters Antrag findet nur seine eigene Stimme (20:1); die CSU setzt den Anstrich der Fassade durch.",
        "sessionId": "sr_20220207",
        "voteId": "sr_20220207_03",
        "press": [
          "merkur_2022-02-10_aerztehaus-bahnhof"
        ]
      },
      {
        "date": "2023-04-24",
        "type": "vote",
        "title": "Fahrgastbefragung Bahnhof",
        "text": "Einstimmig: Online-Befragung zum Nutzungsverhalten am Bahnhof.",
        "sessionId": "sr_20230424",
        "voteId": "sr_20230424_05"
      },
      {
        "date": "2023-09-25",
        "type": "vote",
        "title": "Generalsanierung statt Neubau",
        "text": "Weil nur die Sanierung nennenswert gefördert wird, beschließt der Stadtrat mit 18:2 die Generalsanierung.",
        "sessionId": "sr_20230925",
        "voteId": "sr_20230925_07",
        "press": [
          "merkur_2023-09-29_bahnhof-sanierung"
        ]
      },
      {
        "date": "2025-06-23",
        "type": "proposal",
        "title": "Anträge zur Sanierung",
        "text": "Die Freien Wähler bringen einen Antrag zur Pinselsanierung ein. Kurz zuvor hat die CSU ein Investorenkonzept in der Presse vorgeschlagen."
      },
      {
        "date": "2025-12-01",
        "type": "committee",
        "title": "Rechtliche Prüfung",
        "text": "Das Sachgebiet Liegenschaften lässt die Investorenoption von einer Rechtsanwaltskanzlei prüfen. Eine Bestandsanalyse der DB ergibt Schadensstufe 3."
      },
      {
        "date": "2026-01-12",
        "type": "vote",
        "title": "Konzeptausschreibung beschlossen",
        "text": "Der Stadtrat beschließt die Vorbereitung einer Konzeptausschreibung für einen Investor. Parallel soll der Bauhof die Außenfassade streichen. Im Haushalt stehen 500.000 Euro bereit.",
        "sessionId": "sr_20260112",
        "voteId": "sr_20260112_05"
      }
    ],
    "field": "building",
    "type": "vorhaben",
    "status": "laufend"
  },
  {
    "id": "t3",
    "title": "Parksituation Auf dem Plan",
    "tags": [
      "mobility"
    ],
    "image": null,
    "summary": "Nach der Umgestaltung des Platzes Auf dem Plan mit Mitteln der Städtebauförderung (ca. 2,4 Mio Euro) kam es zu kontroversen Diskussionen über Falschparker und die Anzahl der Parkplätze.",
    "history": [
      {
        "date": "2020-10-26",
        "type": "vote",
        "title": "Tiefgarage unter dem Platz nicht weiterverfolgt",
        "text": "Der Antrag, die Planung zu vertagen und stattdessen ein Tiefgeschoss unter dem Platz zu prüfen, wird mit 8:12 abgelehnt. Der Stadtrat nimmt den Entwurf des Büros Schegk zur Kenntnis. Damit bleiben die oberirdischen Stellplätze die Grundlage der weiteren Planung — die Parksituation, um die es in diesem Dossier geht, entscheidet sich hier.",
        "sessionId": "sr_20201026",
        "voteId": "sr_20201026_03",
        "press": [
          "mz_2020-10-26_plan-tiefgarage",
          "merkur_2020-10-26_plan-tiefgarage"
        ]
      },
      {
        "date": "2023-01-12",
        "type": "vote",
        "title": "Auf dem Plan – Granitpflaster (abgelehnt)",
        "text": "Antrag auf gebundene Granitpflaster-Verlegung knapp abgelehnt (10:11).",
        "sessionId": "sr_20230112",
        "voteId": "sr_20230112_02",
        "press": [
          "sz_2023-01-12_granitpflaster"
        ]
      },
      {
        "date": "2023-03-27",
        "type": "vote",
        "title": "Auf dem Plan – Entwurfsplanung + Ausschreibung",
        "text": "Einstimmig: Entwurfsplanung 13.03.2023 + Ausschreibung mit Teilnahmewettbewerb.",
        "sessionId": "sr_20230327",
        "voteId": "sr_20230327_02"
      },
      {
        "date": "2023-07-24",
        "type": "vote",
        "title": "Denkmalförderung „Auf dem Plan 14\"",
        "text": "100.000 € Bundeszuschuss + 40.000 € städtischer Eigenanteil über „Lebendige Zentren\".",
        "sessionId": "sr_20230724",
        "voteId": "sr_20230724_05"
      },
      {
        "date": "2024-06-01",
        "type": "milestone",
        "title": "Fertigstellung Platzumbau",
        "text": "Der Platz Auf dem Plan wird nach umfangreicher Umgestaltung fertiggestellt. Die Parkplatzanzahl wurde deutlich reduziert, neue Aufenthaltsqualität geschaffen."
      },
      {
        "date": "2025-09-01",
        "type": "proposal",
        "title": "Probleme mit Falschparkern",
        "text": "Seit der Fertigstellung häufen sich Beschwerden über Falschparker, besonders in der Platzmitte. Die PI Moosburg empfiehlt die Ausweisung als verkehrsberuhigten Bereich."
      },
      {
        "date": "2025-12-15",
        "type": "milestone",
        "title": "Stellungnahme Geschäftsleute",
        "text": "Die Moosburger Geschäftsleute fordern eine Überprüfung der Parksituation. Vor Weihnachten werden noch keine Verwarnungen ausgesprochen."
      },
      {
        "date": "2025-12-08",
        "type": "committee",
        "title": "Bauausschuss diskutiert Parkprobleme",
        "text": "StRin Beibl berichtet von dreireihigem Zuparken und zu schnellem Fahren. Absperrungen mit Bäumen und Pollern werden diskutiert, Parkplatzmarkierungen sollen verbessert werden.",
        "sessionId": "bpu_20251208"
      },
      {
        "date": "2026-01-12",
        "type": "vote",
        "title": "Temporäre Parkflächen prüfen",
        "text": "Der Stadtrat beschließt, zusätzliche temporäre Parkflächen für die Wintermonate mit Planern und Städtebauförderung zu prüfen.",
        "sessionId": "sr_20260112",
        "voteId": "sr_20260112_06",
        "press": [
          "merkur_2026-01-12_parken-plan"
        ]
      },
      {
        "date": "2026-01-12",
        "type": "vote",
        "title": "Barken-Abtrennung abgelehnt",
        "text": "Der Vorschlag, den nicht zu beparkenden Bereich mit Barken abzutrennen und Verstöße zu ahnden, wird abgelehnt.",
        "sessionId": "sr_20260112",
        "voteId": "sr_20260112_07",
        "press": [
          "br_2025-09_falschparken-plan"
        ]
      },
      {
        "date": "2026-02-23",
        "type": "milestone",
        "title": "Markierungen werden erneuert",
        "text": "Laut Ergänzung bei Genehmigung der Niederschrift werden die Fahrbahnmarkierungen zeitnah erneuert. Erst danach sollen Verwarnungen ausgestellt werden.",
        "press": [
          "merkur_2026-02-23_parken-plan"
        ]
      }
    ],
    "field": "mobility",
    "type": "konflikt",
    "status": "laufend"
  },
  {
    "id": "t4",
    "title": "Verkehrsberuhigung Innenstadt",
    "tags": [
      "mobility"
    ],
    "image": null,
    "summary": "Auf Antrag von SPD und Grünen werden Tempo-20- und Tempo-30-Zonen in der Innenstadt ausgeweitet. Auch die Bahnhofstraße soll verkehrlich überprüft werden.",
    "history": [
      {
        "date": "2020-11-09",
        "type": "vote",
        "title": "Fahrradstraße Viehmarktstraße",
        "text": "Auf Antrag der Grünen wird die Viehmarktstraße samt einem Stück Landshuter Straße zur Fahrradstraße (10:2).",
        "sessionId": "bpu_20201109",
        "voteId": "bpu_20201109_01"
      },
      {
        "date": "2020-11-09",
        "type": "vote",
        "title": "Fahrradzone um die Graf-Konrad-Straße",
        "text": "Auf Antrag der Grünen wird die Tempo-30-Zone für zwei Jahre zur Fahrradzone (9:3).",
        "sessionId": "bpu_20201109",
        "voteId": "bpu_20201109_02"
      },
      {
        "date": "2021-04-29",
        "type": "vote",